{
  "apiVersion": "modos.pleiades/v1alpha1",
  "authority": {
    "canonical": false,
    "ceiling": "none",
    "writeBackAllowed": false
  },
  "kind": "OntologyProjectionBundle",
  "objectRows": [
    {
      "generation": 1,
      "kind": "Mind",
      "objectId": "mind:pleiades",
      "payload": {
        "apiVersion": "modos.pleiades/v1alpha1",
        "kind": "Mind",
        "metadata": {
          "createdAt": "2026-07-20T00:00:00Z",
          "generation": 1,
          "id": "mind:pleiades",
          "name": "Pleiades persistent mind"
        },
        "partitionPolicy": {
          "conflictVisibility": "steward",
          "globalAuthorityRequired": true,
          "merge": "steward-review",
          "read": "allow-cached",
          "write": "provisional"
        },
        "provenance": {
          "digest": "sha256:1111111111111111111111111111111111111111111111111111111111111111",
          "lineage": [],
          "source": "fixture:seed",
          "trust": "verified",
          "visibility": "public"
        },
        "spec": {
          "dissentPreserved": true,
          "modelReplaceability": true,
          "persistentOrganization": true
        }
      },
      "snapshotDigest": "sha256:fb24a0a0c1394fc8f4a45df9e68eb5d8ed9a3e849882c19ff0b743ffd8202196"
    },
    {
      "generation": 1,
      "kind": "CognitiveWorkspace",
      "objectId": "workspace:pleiades",
      "payload": {
        "apiVersion": "modos.pleiades/v1alpha1",
        "kind": "CognitiveWorkspace",
        "metadata": {
          "createdAt": "2026-07-20T00:00:00Z",
          "generation": 1,
          "id": "workspace:pleiades",
          "name": "Pleiades shared cognitive workspace"
        },
        "partitionPolicy": {
          "conflictVisibility": "steward",
          "globalAuthorityRequired": true,
          "merge": "steward-review",
          "read": "allow-cached",
          "write": "provisional"
        },
        "provenance": {
          "digest": "sha256:2222222222222222222222222222222222222222222222222222222222222222",
          "lineage": [],
          "source": "fixture:seed",
          "trust": "verified",
          "visibility": "public"
        },
        "spec": {
          "firstPassIsolation": true,
          "typedContributions": true
        }
      },
      "snapshotDigest": "sha256:fb24a0a0c1394fc8f4a45df9e68eb5d8ed9a3e849882c19ff0b743ffd8202196"
    }
  ],
  "projectionVersion": "v1alpha1",
  "relationRows": [
    {
      "attributes": {},
      "snapshotDigest": "sha256:fb24a0a0c1394fc8f4a45df9e68eb5d8ed9a3e849882c19ff0b743ffd8202196",
      "sourceRef": "mind:pleiades",
      "targetRef": "workspace:pleiades",
      "type": "participatesIn"
    }
  ],
  "snapshotRow": {
    "closureReceiptDigest": "sha256:7e4bc0216488af205339cc0a59b1eb4de5bc435be46d1e9b8dbb7aa263b64487",
    "mindId": "mind:pleiades",
    "payload": {
      "apiVersion": "modos.pleiades/v1alpha1",
      "kind": "OntologySnapshot",
      "mindId": "mind:pleiades",
      "objects": [
        {
          "apiVersion": "modos.pleiades/v1alpha1",
          "kind": "Mind",
          "metadata": {
            "createdAt": "2026-07-20T00:00:00Z",
            "generation": 1,
            "id": "mind:pleiades",
            "name": "Pleiades persistent mind"
          },
          "partitionPolicy": {
            "conflictVisibility": "steward",
            "globalAuthorityRequired": true,
            "merge": "steward-review",
            "read": "allow-cached",
            "write": "provisional"
          },
          "provenance": {
            "digest": "sha256:1111111111111111111111111111111111111111111111111111111111111111",
            "lineage": [],
            "source": "fixture:seed",
            "trust": "verified",
            "visibility": "public"
          },
          "spec": {
            "dissentPreserved": true,
            "modelReplaceability": true,
            "persistentOrganization": true
          }
        },
        {
          "apiVersion": "modos.pleiades/v1alpha1",
          "kind": "CognitiveWorkspace",
          "metadata": {
            "createdAt": "2026-07-20T00:00:00Z",
            "generation": 1,
            "id": "workspace:pleiades",
            "name": "Pleiades shared cognitive workspace"
          },
          "partitionPolicy": {
            "conflictVisibility": "steward",
            "globalAuthorityRequired": true,
            "merge": "steward-review",
            "read": "allow-cached",
            "write": "provisional"
          },
          "provenance": {
            "digest": "sha256:2222222222222222222222222222222222222222222222222222222222222222",
            "lineage": [],
            "source": "fixture:seed",
            "trust": "verified",
            "visibility": "public"
          },
          "spec": {
            "firstPassIsolation": true,
            "typedContributions": true
          }
        }
      ],
      "relations": [
        {
          "sourceRef": "mind:pleiades",
          "targetRef": "workspace:pleiades",
          "type": "participatesIn"
        }
      ],
      "schemaVersion": "v1alpha1"
    },
    "schemaVersion": "v1alpha1",
    "snapshotDigest": "sha256:fb24a0a0c1394fc8f4a45df9e68eb5d8ed9a3e849882c19ff0b743ffd8202196",
    "sourceSnapshotDigest": "sha256:6cdb735ccdd132b7c86a7f60df6f953138f3555bfc362708947f7a8f5832ea51"
  },
  "source": {
    "closureReceiptDigest": "sha256:7e4bc0216488af205339cc0a59b1eb4de5bc435be46d1e9b8dbb7aa263b64487",
    "mindId": "mind:pleiades",
    "schemaVersion": "v1alpha1",
    "snapshotDigest": "sha256:fb24a0a0c1394fc8f4a45df9e68eb5d8ed9a3e849882c19ff0b743ffd8202196"
  }
}
